24,0,5,267,"Gamification towards sustainable mobile application Gamification is not a newly emerging concept. Perhaps, it is a new term to some people. Gamification is a powerful new strategy to influence and motivate groups of people. It applies game mechanics to non-game activities to change the user's behavior of an application. It improves the engagement of user by keeping score of points earned through various activities on the application. The recent gamified websites or a related service such as Foursquare is a location-based application that pinpoints where you are and your activities. Users of the Foursquare can ``check in'' to various locations on their mobile phones and gain incentives like badges or deals. Gamification is utilised as a mean to build up user loyalty, and not so much to gain their long-term engagement. This article discusses how the gamification can help to drive the sustainability after a mobile application has been delivered and is in use. It is important to make mobile application continuously visible and sustainable if the concept of gamification has been used correctly. The more users can gain from the virtual and tangible rewards of using our application, the more we can be rewarded from our users. It also discusses how adding a ``game layer'' has improved the basic functions in society like educating people to become more responsible and helpful and use badges as virtual reward to users who contribute photos. Interactive mobile application designed to change the way of people report road accident cases with applying a simplicity and convenience principles. For instance, user just needs to snap photo and touch on screen to report a road accident case. computer games, interactive systems, mobile computing, Web sites, gamification, sustainable mobile application, game mechanics, nongame activity, user behavior, gamified Web sites, Foursquare, location-based application, mobile phones, user loyalty, long-term engagement, sustainability, virtual rewards, tangible rewards, interactive mobile application, Mobile communication, Games, Road accidents, Communities, Mobile handsets, Educational institutions, game, interactive mobile application, point-based location technique",gamification towards sustainable mobile application gamification is not a newly emerging concept perhaps it is a new term to some people gamification is a powerful new strategy to influence and motivate groups of people it applies game mechanics to non game activities to change the user s behavior of an application it improves the engagement of user by keeping score of points earned through various activities on the application the recent gamified websites or a related service such as foursquare is a location based application that pinpoints where you are and your activities users of the foursquare can check in to various locations on their mobile phones and gain incentives like badges or deals gamification is utilised as a mean to build up user loyalty and not so much to gain their long term engagement this article discusses how the gamification can help to drive the sustainability after a mobile application has been delivered and is in use it is important to make mobile application continuously visible and sustainable if the concept of gamification has been used correctly the more users can gain from the virtual and tangible rewards of using our application the more we can be rewarded from our users it also discusses how adding a game layer has improved the basic functions in society like educating people to become more responsible and helpful and use badges as virtual reward to users who contribute photos interactive mobile application designed to change the way of people report road accident cases with applying a simplicity and convenience principles for instance user just needs to snap photo and touch on screen to report a road accident case computer games interactive systems mobile computing web sites gamification sustainable mobile application game mechanics nongame activity user behavior gamified web sites foursquare location based application mobile phones user loyalty long term engagement sustainability virtual rewards tangible rewards interactive mobile application mobile communication games road accidents communities mobile handsets educational institutions game interactive mobile application point based location technique,1,0,0,0,0,0,0,0,0,0,0,0,0,0,0,0,0,0,0,0,0,0,0,0,0,0,0,0,0,0,0,0,0,0,0,0,0,0,0,0,0,0,0,0,1,1,0,0,0,0,0,0,0,0,0,0,0,0,0,0,0,0,0,0,0,0,0,0,0,0,0,0,0,0,0,0,0,0,0,0,1.0,0.0,0.0,0.0,0.0,0.0
25,0,6,242,"Code Defenders: A Mutation Testing Game Mutation testing is endorsed by software testing researchers for its unique capability of providing pragmatic estimates of a test suite's fault detection capability, and for guiding testers in improving their test suites. In practice, however, wide-spread adoption of mutation testing is hampered because any non-trivial program results in huge numbers of mutants, many of which are either trivial or equivalent, and thus useless. Trivial mutants reduce the motivation of developers in trusting and using the technique, while equivalent mutants are frustratingly difficult to handle. These problems are exacerbated by insufficient education on testing, which often means that mutation testing is not well understood in practice. These are examples of the types of problems that gamification aims to overcome by making such tedious activities competitive and entertaining. In this paper, we introduce the first steps towards building Code Defenders, a mutation testing game where players take the role of an attacker, who aims to create the most subtle non-equivalent mutants, or a defender, who aims to create strong tests to kill these mutants. The benefits of such an approach are manifold: The game can serve an educational role by engaging learners in mutation testing activities in a fun way. Experienced players will produce strong test suites, capable of detecting even the most subtle bugs that other players can conceive. Equivalent mutants are handled by making them a special part of the gameplay, where points are at stake in duels between attackers and defenders. program testing, software quality, code defender, mutation testing game, software testing, fault detection, gamification, Games, Software, Conferences, Software testing, Education, Context, Mutation testing, Gamification, Testing education",code defenders a mutation testing game mutation testing is endorsed by software testing researchers for its unique capability of providing pragmatic estimates of a test suite s fault detection capability and for guiding testers in improving their test suites in practice however wide spread adoption of mutation testing is hampered because any non trivial program results in huge numbers of mutants many of which are either trivial or equivalent and thus useless trivial mutants reduce the motivation of developers in trusting and using the technique while equivalent mutants are frustratingly difficult to handle these problems are exacerbated by insufficient education on testing which often means that mutation testing is not well understood in practice these are examples of the types of problems that gamification aims to overcome by making such tedious activities competitive and entertaining in this paper we introduce the first steps towards building code defenders a mutation testing game where players take the role of an attacker who aims to create the most subtle non equivalent mutants or a defender who aims to create strong tests to kill these mutants the benefits of such an approach are manifold the game can serve an educational role by engaging learners in mutation testing activities in a fun way experienced players will produce strong test suites capable of detecting even the most subtle bugs that other players can conceive equivalent mutants are handled by making them a special part of the gameplay where points are at stake in duels between attackers and defenders program testing software quality code defender mutation testing game software testing fault detection gamification games software conferences software testing education context mutation testing gamification testing education,1,0,0,0,0,0,0,0,0,0,0,0,0,0,0,0,0,0,0,0,0,0,0,0,0,0,0,0,0,0,0,0,0,0,0,0,0,0,0,0,0,0,0,0,0,0,1,0,0,0,0,0,0,0,0,0,0,0,0,0,0,0,0,0,0,0,0,0,0,0,0,0,0,0,0,0,0,0,0,0,0.0,0.0,0.0,0.0,0.0,1.0
26,0,6,230,"Acceptance Requirements and Their Gamification Solutions We live in the days of social software where social interactions, from simple notifications to complex business processes, are supported by software platforms such as Facebook and Twitter. But for any social software to be successful, it must be used by a sizeable portion of its intended user community. Usage requirements are usually referred to as Acceptance Requirements and they have been studied in the literature both for general technology as well as software. Operationalization techniques for such requirements often consist of making a game out of software usage where users are rewarded/penalized depending onthe degree of their participation. The game may be competitive or non-competitive, depending on the anticipated personality traits of intended users. Making a game out of usage is often referred to as Gamification, and gamification has attracted huge attention in the literature for the past few years because it offers a novelapproach to software technology usage. This paper proposes a generic framework for designing gamified solutions for acceptance requirements. The framework consists of a generic acceptance goal model that characterizes the problem space by capturing possible refinements for acceptance requirements, and a generic gamification model that capturespossible gamified operationalizations of acceptance requirements. These models have been extracted from the literature and they are highly dependent on context (cognitive and social) elements of the intended user community. The proposed framework isillustrated with the Meeting Scheduler exemplar. social networking (online), software engineering, acceptance requirement, gamification solution, social software, social interactions, Facebook, Twitter, user community, operationalization techniques, software usage, generic acceptance goal model, Meeting Scheduler exemplar, Games, Context modeling, Context, Software, Psychology, Training, Analytical models, Acceptance requirements, gamification, context models, goal models, requirements engineering",acceptance requirements and their gamification solutions we live in the days of social software where social interactions from simple notifications to complex business processes are supported by software platforms such as facebook and twitter but for any social software to be successful it must be used by a sizeable portion of its intended user community usage requirements are usually referred to as acceptance requirements and they have been studied in the literature both for general technology as well as software operationalization techniques for such requirements often consist of making a game out of software usage where users are rewarded penalized depending onthe degree of their participation the game may be competitive or non competitive depending on the anticipated personality traits of intended users making a game out of usage is often referred to as gamification and gamification has attracted huge attention in the literature for the past few years because it offers a novelapproach to software technology usage this paper proposes a generic framework for designing gamified solutions for acceptance requirements the framework consists of a generic acceptance goal model that characterizes the problem space by capturing possible refinements for acceptance requirements and a generic gamification model that capturespossible gamified operationalizations of acceptance requirements these models have been extracted from the literature and they are highly dependent on context cognitive and social elements of the intended user community the proposed framework isillustrated with the meeting scheduler exemplar social networking online software engineering acceptance requirement gamification solution social software social interactions facebook twitter user community operationalization techniques software usage generic acceptance goal model meeting scheduler exemplar games context modeling context software psychology training analytical models acceptance requirements gamification context models goal models requirements engineering,1,0,0,0,0,0,0,0,0,0,0,0,0,0,0,0,0,0,0,0,0,0,0,0,0,0,0,0,0,0,0,0,0,0,0,0,0,0,0,0,0,0,0,0,0,0,0,1,0,0,0,0,0,0,0,0,0,0,0,0,0,0,0,0,0,0,0,0,0,0,0,0,0,0,0,0,0,0,0,0,0.0,0.0,0.0,0.0,0.0,1.0
27,0,16,106,"Poster: Design and development of a virtual reality system for vocational rehabilitation of individuals with disabilities This paper considers the design and development of a virtual reality system that aids in vocational rehabilitation of individuals with disabilities. The system focuses on three types of disabilities: autism spectrum disorder, traumatic brain injury, and severe mobility impairment. The system allows job trainers to rapidly assess the capabilities of individuals with disabilities, detect the most suitable job for them, and train them in a safe and motivating environment where there are no significant consequences of making errors. Design considerations and research questions that arise throughout development are shared to create awareness of the special considerations involved in developing virtual reality systems for individuals with disabilities. computer based training, handicapped aids, human computer interaction, medical disorders, software engineering, virtual reality, vocational training, virtual reality system design, vocational rehabilitation, virtual reality system development, disabled individuals, autism spectrum disorder, traumatic brain injury, severe mobility impairment, job trainers, Training, Virtual environments, Variable speed drives, Employment, Autism, Tracking, Virtual reality simulation, virtual interaction, tangible interaction, navigation through virtual environments, vocational rehabilitation, disabilities, gamification",poster design and development of a virtual reality system for vocational rehabilitation of individuals with disabilities this paper considers the design and development of a virtual reality system that aids in vocational rehabilitation of individuals with disabilities the system focuses on three types of disabilities autism spectrum disorder traumatic brain injury and severe mobility impairment the system allows job trainers to rapidly assess the capabilities of individuals with disabilities detect the most suitable job for them and train them in a safe and motivating environment where there are no significant consequences of making errors design considerations and research questions that arise throughout development are shared to create awareness of the special considerations involved in developing virtual reality systems for individuals with disabilities computer based training handicapped aids human computer interaction medical disorders software engineering virtual reality vocational training virtual reality system design vocational rehabilitation virtual reality system development disabled individuals autism spectrum disorder traumatic brain injury severe mobility impairment job trainers training virtual environments variable speed drives employment autism tracking virtual reality simulation virtual interaction tangible interaction navigation through virtual environments vocational rehabilitation disabilities gamification,1,0,0,0,0,0,0,0,0,0,0,0,0,0,0,0,0,0,0,0,0,0,0,0,0,0,0,0,0,0,0,0,0,0,0,0,0,0,0,0,0,0,0,0,0,0,0,0,1,1,1,0,0,0,0,0,0,0,0,0,0,0,0,0,0,0,0,0,0,0,0,0,0,0,0,0,0,0,0,0,0.0,0.0,0.0,1.0,0.0,0.0
28,0,2,60,"Crowd development Crowd development is a development process designed for transient workers of varying skill. Work is organized into microtasks, which are short, self-descriptive, and modular. Microtasks recursively spawn microtasks and are matched to workers, who accrue points reflecting value created. Crowd development might help to reduce time to market and software development costs, increase programmer productivity, and make programming more fun. cost reduction, groupware, software engineering, time to market, transient workers, self-descriptive microtasks, modular microtasks, short microtasks, crowd development, time to market reduction, software development cost reduction, programmer productivity, Software, Games, Programming, Software engineering, Transient analysis, Educational institutions, Testing, crowdsourcing, distributed development, gamification, social software development",crowd development crowd development is a development process designed for transient workers of varying skill work is organized into microtasks which are short self descriptive and modular microtasks recursively spawn microtasks and are matched to workers who accrue points reflecting value created crowd development might help to reduce time to market and software development costs increase programmer productivity and make programming more fun cost reduction groupware software engineering time to market transient workers self descriptive microtasks modular microtasks short microtasks crowd development time to market reduction software development cost reduction programmer productivity software games programming software engineering transient analysis educational institutions testing crowdsourcing distributed development gamification social software development,1,0,0,0,0,0,0,0,0,0,0,0,0,0,0,0,0,0,0,0,0,0,0,0,0,0,0,0,0,0,0,0,0,0,0,0,0,0,0,0,0,0,0,0,0,0,0,0,0,0,0,1,1,1,0,0,0,0,0,0,0,0,0,0,0,0,0,0,0,0,0,0,0,0,0,0,0,0,0,0,0.0,0.0,1.0,0.0,0.0,0.0
29,0,11,232,"Gamification of Business Processes: Re-designing Work in Production and Service Industry In this work we provide an overview of gamification, i.e. the application of methods from game design to enrich non-gaming processes. The contribution is divided into five subsections: an introduction focusing on the progression of gamification through the hype cycle in the recent years (1), a brief introduction to gamification mechanics (1) and an overview of the state of the art in established areas (3). The focus is a discussion of more recent attempts of gamification in service and production (4). We also discuss the ethical implications (5) and the future perspectives (6) of gamified business processes. Gamification has been successfully applied in the domains education (serious games) and health (exergames) and is spreading to other areas. In recent years there have been various attempts to ``gamify'' business processes. While the first efforts date back as far as the collection of miles in frequent flyer programs, we will portray some of the more recent and comprehensive software-based approaches in the service industry, e.g. the gamification of processes in sales and marketing. We discuss their accomplishments as well as their social and ethical implicatio. Finally a very recent approach is presented: the application of gamification in the domain of industrial production. We discuss the special requirements in this domain and the effects on the business level and on the users. We conclude with a prognosis on the future development of gamification. Gamification, Assistive technology, Computer-assisted instruction, Augmented reality, Human machine interaction",gamification of business processes re designing work in production and service industry in this work we provide an overview of gamification i e the application of methods from game design to enrich non gaming processes the contribution is divided into five subsections an introduction focusing on the progression of gamification through the hype cycle in the recent years 1 a brief introduction to gamification mechanics 1 and an overview of the state of the art in established areas 3 the focus is a discussion of more recent attempts of gamification in service and production 4 we also discuss the ethical implications 5 and the future perspectives 6 of gamified business processes gamification has been successfully applied in the domains education serious games and health exergames and is spreading to other areas in recent years there have been various attempts to gamify business processes while the first efforts date back as far as the collection of miles in frequent flyer programs we will portray some of the more recent and comprehensive software based approaches in the service industry e g the gamification of processes in sales and marketing we discuss their accomplishments as well as their social and ethical implicatio finally a very recent approach is presented the application of gamification in the domain of industrial production we discuss the special requirements in this domain and the effects on the business level and on the users we conclude with a prognosis on the future development of gamification gamification assistive technology computer assisted instruction augmented reality human machine interaction,0,0,0,0,0,0,0,0,0,0,0,0,0,0,0,0,1,0,0,0,0,0,0,0,0,0,0,0,0,0,0,0,0,0,0,0,0,0,0,0,0,0,0,0,0,0,0,0,0,0,0,0,0,0,0,0,0,0,0,0,0,0,0,0,0,0,0,0,0,0,0,0,0,0,0,0,0,0,0,0,0.0,0.0,0.0,0.0,1.0,0.0
30,0,11,180,"Simulation-games for Learning Conducive Workplaces: A Case Study for Manual Assembly All segments of stakeholders in society need to understand economic, environmental and social connections and implications in order to facilitate sustainable development. Currently many people - especially in emerging countries - are not aware of the challenges associated with sustainability. In addition new technology has to be developed to find solutions for providing growth without exceeding the resource boundaries of our planet. This demands a drastically increased learning and teaching productivity and thus new approaches for education. Exemplarily for engineering education, the authors present a concept in which simulation-games are applied in order to support training for assembly processes on manual workplaces. The Assembly Game and the Gaming System are introduced. The first game is played on portable devices. Learners acquire knowledge of the assembly sequence of a bicycle e-motor. The second game is played on a manual assembly workplace. It encourages practice based learning by combining gaming software with a manual assembly workplace. Both games are implemented in education oriented software with strong visual features. Motion capture technology is used in order to support the immediate response to the user's actions. Learnstruments, games, gamification, workplace training, manual assembly",simulation games for learning conducive workplaces a case study for manual assembly all segments of stakeholders in society need to understand economic environmental and social connections and implications in order to facilitate sustainable development currently many people especially in emerging countries are not aware of the challenges associated with sustainability in addition new technology has to be developed to find solutions for providing growth without exceeding the resource boundaries of our planet this demands a drastically increased learning and teaching productivity and thus new approaches for education exemplarily for engineering education the authors present a concept in which simulation games are applied in order to support training for assembly processes on manual workplaces the assembly game and the gaming system are introduced the first game is played on portable devices learners acquire knowledge of the assembly sequence of a bicycle e motor the second game is played on a manual assembly workplace it encourages practice based learning by combining gaming software with a manual assembly workplace both games are implemented in education oriented software with strong visual features motion capture technology is used in order to support the immediate response to the user s actions learnstruments games gamification workplace training manual assembly,0,0,0,0,0,0,0,0,0,0,0,0,0,0,0,0,0,0,0,0,0,0,0,0,0,0,0,0,0,0,0,0,0,0,0,0,0,0,0,0,0,0,0,0,0,0,0,0,0,0,0,0,0,0,1,1,0,0,0,0,0,0,0,0,0,0,0,0,0,0,0,0,0,0,0,0,0,0,0,0,0.0,0.0,0.0,0.0,0.0,1.0
