31,0,10,163,"Gamification and serious game approaches for adult literacy tablet software In this paper, we overview the design of tablet apps we designed and built to teach literacy to adults, and present the results and conclusions derived from experiments performed with target users. Low adult literacy is a significant problem with a high economic cost both for the individuals and for society. Programs created to address low adult literacy face access and engagement barriers that tablet software may be able to help overcome. We designed three tablet apps, using two contrasting approaches of incorporating game-design elements to engage the users. We tested the apps with participants from the Brant Skills Centre, a non-profit organization that offers adult literacy programs in Brantford, Ontario. Though participants were divided on whether they preferred the apps to more traditional instruction, most participants preferred using the apps in addition to more traditional instruction. Based on this we conclude that gamification and serious game design approaches were effective at increasing learner engagement, and we propose a direction for future research. Gamification, Serious game, Tablet user experience, User experience, Literacy, Adult literacy",gamification and serious game approaches for adult literacy tablet software in this paper we overview the design of tablet apps we designed and built to teach literacy to adults and present the results and conclusions derived from experiments performed with target users low adult literacy is a significant problem with a high economic cost both for the individuals and for society programs created to address low adult literacy face access and engagement barriers that tablet software may be able to help overcome we designed three tablet apps using two contrasting approaches of incorporating game design elements to engage the users we tested the apps with participants from the brant skills centre a non profit organization that offers adult literacy programs in brantford ontario though participants were divided on whether they preferred the apps to more traditional instruction most participants preferred using the apps in addition to more traditional instruction based on this we conclude that gamification and serious game design approaches were effective at increasing learner engagement and we propose a direction for future research gamification serious game tablet user experience user experience literacy adult literacy,0,0,0,0,0,0,0,0,0,0,0,0,0,0,0,0,0,0,0,0,0,0,0,0,0,0,0,0,0,0,0,0,0,0,0,0,0,0,0,0,0,0,0,0,0,0,0,0,0,0,0,0,0,0,0,0,0,0,0,0,0,0,0,0,0,0,0,0,0,0,0,0,0,0,0,0,0,0,0,0,0.0,0.0,0.0,1.0,0.0,0.0
32,0,9,283,"Human Factors Issues in Developing Country Remote K-12 Education Remote sites in South Africa can be characterized by a lack of inter-city transport, lack of societal infrastructure, and minimal computing resources and access to them. As a result, Kindergarten-12th Grade (K-12) education has not used many features of educational technology that require significant bandwidth. This case study analyzes the availability and uses of teaching techniques and computing technologies in Grades 10, 11, and 12 Computer Applications Technology classes in a remote town in South Africa. The technologies and techniques trialed showed promise of usefulness in being more engaging to student interest than those presently used. Some students, who desired a job in IT in the future, were more motivated and remembered more than others. The technologies were a bit tricky in setting up and it was recommended that the researchers, in addition to special work sessions with the teachers, team taught with the teachers for their first time using the technologies. For advanced students, a computer club was recommended that might allow students to explore subjects and job opportunities that did not fit within their class structure. Human factors issues focussed on ease of use and intuitiveness of technologies for both teachers and students. Classes are only 50minutes and, within so short a time, if the technology becomes a hurdle rather than a vehicle for teaching a class concept, it defeats its own purpose. Thus, technologies need to be selected carefully and all supporting technology needs to be installed and ready for use. For companies developing K-12 technologies, if they have a preference for e.g., browsers, they should provide a hyperlink to the download site for their users. Also, all software should have a one-page summary of commands and software use. ICT4D, Gamification, Internet in education",human factors issues in developing country remote k 12 education remote sites in south africa can be characterized by a lack of inter city transport lack of societal infrastructure and minimal computing resources and access to them as a result kindergarten 12th grade k 12 education has not used many features of educational technology that require significant bandwidth this case study analyzes the availability and uses of teaching techniques and computing technologies in grades 10 11 and 12 computer applications technology classes in a remote town in south africa the technologies and techniques trialed showed promise of usefulness in being more engaging to student interest than those presently used some students who desired a job in it in the future were more motivated and remembered more than others the technologies were a bit tricky in setting up and it was recommended that the researchers in addition to special work sessions with the teachers team taught with the teachers for their first time using the technologies for advanced students a computer club was recommended that might allow students to explore subjects and job opportunities that did not fit within their class structure human factors issues focussed on ease of use and intuitiveness of technologies for both teachers and students classes are only 50minutes and within so short a time if the technology becomes a hurdle rather than a vehicle for teaching a class concept it defeats its own purpose thus technologies need to be selected carefully and all supporting technology needs to be installed and ready for use for companies developing k 12 technologies if they have a preference for e g browsers they should provide a hyperlink to the download site for their users also all software should have a one page summary of commands and software use ict4d gamification internet in education,0,0,0,0,0,0,0,0,0,0,0,0,0,0,0,0,0,0,0,0,0,0,0,0,0,0,0,0,0,0,0,0,0,0,0,0,0,0,0,0,0,0,0,0,0,0,0,0,0,0,0,0,0,0,0,0,1,0,0,0,0,0,0,0,0,0,0,0,0,0,0,0,0,0,0,0,0,0,0,0,0.0,0.0,0.0,0.0,1.0,0.0
33,0,9,198,"Betting system for formative code review in educational competitions Using competitions to motivate students is a well-known practice that has proved to be successful. Nevertheless, grading students only through their results in the competition could unfairly limit the range of grades that each student can get: regardless of the quality of the different teams participating, one student must necessarily win the tournament, another must be second, and so on until the last place. In fact, player rankings are relative assessments that are conditioned by the performance of every student. In this paper, we propose solving this issue by making students do a code review before betting on the competition. By betting, the grade of students depends both on the performance of their own solution and the one they bet on. This way, grades represent not only coding skills, but also code analysis skills, widening the attainable range of grades and allowing for a fairer grade distribution. As a result, students that are not so proficient in coding are rewarded if they demonstrate they can do a good analysis of the source code written by others, which is a very valuable skill in the professional world. We provide a case study in an undergraduate course, showing positive results. Assessment, Gamification, Competition, Software development, Code review",betting system for formative code review in educational competitions using competitions to motivate students is a well known practice that has proved to be successful nevertheless grading students only through their results in the competition could unfairly limit the range of grades that each student can get regardless of the quality of the different teams participating one student must necessarily win the tournament another must be second and so on until the last place in fact player rankings are relative assessments that are conditioned by the performance of every student in this paper we propose solving this issue by making students do a code review before betting on the competition by betting the grade of students depends both on the performance of their own solution and the one they bet on this way grades represent not only coding skills but also code analysis skills widening the attainable range of grades and allowing for a fairer grade distribution as a result students that are not so proficient in coding are rewarded if they demonstrate they can do a good analysis of the source code written by others which is a very valuable skill in the professional world we provide a case study in an undergraduate course showing positive results assessment gamification competition software development code review,0,0,0,0,0,0,0,0,0,0,0,0,0,0,0,0,0,0,0,0,0,0,0,0,0,0,0,0,0,0,0,0,0,0,0,0,0,0,0,0,0,0,0,0,0,0,0,0,0,0,0,0,0,0,0,0,0,1,1,0,0,0,0,0,0,0,0,0,0,0,0,0,0,0,0,0,0,0,0,0,0.0,0.0,0.0,1.0,0.0,0.0
34,0,10,210,"How Gamification Applies for Educational Purpose Specially with College Algebra Gaming environments have been used to teach mathematical topics such as addition and division in a fun manner**http://www.thefreedictionary.com/fun.. However, when it comes to college level mathematical concepts such as the use of the quadratic formula, there are very few software that explain these concepts in a fun way. In this paper, we present a first step towards using video game elements and Artificial Intelligence Tutoring system techniques to teach mathematical concepts such as factoring and the quadratic formula. These concepts are explained in a way that helps learners make a connection between the mathematical concepts and their real life experience. These methods of learning are supported by several studies (Bonwell & Eison, 1991; Donovan & Bransford, 2004; Scarlatos, 2006). We use gamification techniques during the training and test phases to help students learn the mathematical concepts. We then compare the performance of students who used our system (MathDungeon) with that of students who used the most popular math tutoring programs used in US colleges: Assessment and Learning, K-12, Higher Education (ALEKS). The number of students who used MathDungeon and scored above the median score on the test of math performance was greater than the number of students who used ALEKS and scored higher than the median score. Gamification, Artificial Intelligence, Tutoring systems, How to gamify mathematics' concepts",how gamification applies for educational purpose specially with college algebra gaming environments have been used to teach mathematical topics such as addition and division in a fun manner http www thefreedictionary com fun however when it comes to college level mathematical concepts such as the use of the quadratic formula there are very few software that explain these concepts in a fun way in this paper we present a first step towards using video game elements and artificial intelligence tutoring system techniques to teach mathematical concepts such as factoring and the quadratic formula these concepts are explained in a way that helps learners make a connection between the mathematical concepts and their real life experience these methods of learning are supported by several studies bonwell eison 1991 donovan bransford 2004 scarlatos 2006 we use gamification techniques during the training and test phases to help students learn the mathematical concepts we then compare the performance of students who used our system mathdungeon with that of students who used the most popular math tutoring programs used in us colleges assessment and learning k 12 higher education aleks the number of students who used mathdungeon and scored above the median score on the test of math performance was greater than the number of students who used aleks and scored higher than the median score gamification artificial intelligence tutoring systems how to gamify mathematics concepts,0,0,0,0,0,0,0,0,0,0,0,0,0,0,0,0,0,0,0,0,0,0,0,0,0,0,0,0,0,0,0,0,0,0,0,0,0,0,0,0,0,0,0,0,0,0,0,0,0,0,0,0,0,0,0,0,0,0,0,1,1,1,0,0,0,0,0,0,0,0,0,0,0,0,0,0,0,0,0,0,0.0,0.0,0.0,1.0,0.0,0.0
35,1,5,137,"Gamification of software engineering curriculum Advances in computer gaming technology, digital game design, game engine development, mobile computing, and mobile software engineering, stimulated active research on gamification of processes and activities in ""serious"" areas such as education, learning, corporate training, management, administration, marketing, simulations of complex physical objects and phenomena, engineering, project management, Wellness, healthcare, chemistry, and other areas. The performed analysis of the current status of serious games' applications in industry clearly shows that it will soon need a significant number of well educated and highly skilled specialists in gamification of main business processes, including serious games' software engineers, analysts, designers, developers, testers, etc. The findings and outcomes of performed analysis motivated the authors - faculty and graduate student at Bradley University (Peoria, IL, U.S.A.) - to work collaboratively, propose a new approach and ways of gamification of software engineering curriculum. gamification, serious games,  software engineering,  curriculum",gamification of software engineering curriculum advances in computer gaming technology digital game design game engine development mobile computing and mobile software engineering stimulated active research on gamification of processes and activities in serious areas such as education learning corporate training management administration marketing simulations of complex physical objects and phenomena engineering project management wellness healthcare chemistry and other areas the performed analysis of the current status of serious games applications in industry clearly shows that it will soon need a significant number of well educated and highly skilled specialists in gamification of main business processes including serious games software engineers analysts designers developers testers etc the findings and outcomes of performed analysis motivated the authors faculty and graduate student at bradley university peoria il u s a to work collaboratively propose a new approach and ways of gamification of software engineering curriculum gamification serious games software engineering curriculum,0,0,0,0,0,0,0,0,0,0,0,0,0,0,0,0,0,0,0,0,0,0,0,0,0,0,0,0,0,0,0,0,0,0,0,0,0,0,0,0,0,0,0,0,0,0,0,0,0,0,0,0,0,0,0,0,0,0,0,0,0,0,1,0,0,0,0,0,0,0,0,0,0,0,0,0,0,0,0,0,0.0,0.0,0.0,1.0,0.0,0.0
36,1,14,102,"Redesign of a Gamified Software Engineering Course Step 2 Scaffolding: Bridging the Motivation Gap This paper builds on work previously published as best paper at CSEDU 2013 [1], which describes the motivation gap between the teacher'sview ofstudent motivation and their actual motivation. As a result of this mismatch, the gamified Software Engineering course under observation [2], did not appeal to the students in the expected way. Our findings give rise to a number of design criteria for e-Learning and blended coursethat address the motivation gap in order to increase the numberstudentsthat are able to self-regulate their studies and stay or become motivated by the course as defined by Dan Pink's motivational factors: autonomy, mastery andpurpose [3]. motivation,  e-learning,  blended learning,  gamification,  software engineering,  education",redesign of a gamified software engineering course step 2 scaffolding bridging the motivation gap this paper builds on work previously published as best paper at csedu 2013 1 which describes the motivation gap between the teacher sview ofstudent motivation and their actual motivation as a result of this mismatch the gamified software engineering course under observation 2 did not appeal to the students in the expected way our findings give rise to a number of design criteria for e learning and blended coursethat address the motivation gap in order to increase the numberstudentsthat are able to self regulate their studies and stay or become motivated by the course as defined by dan pink s motivational factors autonomy mastery andpurpose 3 motivation e learning blended learning gamification software engineering education,1,0,0,0,0,0,0,0,0,0,0,0,0,0,0,0,0,0,0,0,0,0,0,0,0,0,0,0,0,0,0,0,0,0,0,0,0,0,0,0,0,0,0,0,0,0,0,0,0,0,0,0,0,0,0,0,0,0,0,0,0,0,0,0,0,0,0,0,0,0,0,0,0,0,0,0,0,0,0,0,0.0,0.0,1.0,0.0,0.0,0.0
37,1,11,84,"It was a bit of a race: Gamification of version control The adoption of software engineering practices cannot always be achieved by education or processes. However, social software has the potential for supporting deliberate behavior change. We present preliminary results of an experiment in which we encouraged computer science students to make more frequent commits to version control by using a social software application. We provided a web-based newsfeed of commits that also displayed a leaderboard. While we have yet to analyze the data, interviews we conducted with the participants allow for first qualitative insights. Version Control, Commits, Social Software, Motivation, Behavior Change, Gamification",it was a bit of a race gamification of version control the adoption of software engineering practices cannot always be achieved by education or processes however social software has the potential for supporting deliberate behavior change we present preliminary results of an experiment in which we encouraged computer science students to make more frequent commits to version control by using a social software application we provided a web based newsfeed of commits that also displayed a leaderboard while we have yet to analyze the data interviews we conducted with the participants allow for first qualitative insights version control commits social software motivation behavior change gamification,0,0,0,0,0,0,0,0,0,0,0,0,0,0,0,0,0,0,0,0,0,0,1,0,0,0,0,0,0,0,0,0,0,0,0,0,0,0,0,0,0,0,0,0,0,0,0,0,0,0,0,0,0,0,0,0,0,0,0,0,0,0,0,0,0,0,0,0,0,0,0,0,0,0,0,0,0,0,0,0,0.0,1.0,0.0,0.0,0.0,0.0
38,1,11,131,"A competitive-collaborative approach for introducing software engineering in a CS2 class Introductory Computer Science (CS) classes are typically competitive in nature. The cutthroat nature of these classes comes from students attempting to get as high a grade as possible, which may or may not correlate with actual learning. Further, there is very little collaboration allowed in most introductory CS classes. Most assignments are completed individually since many educators feel that students learn the most, especially in introductory classes, by working alone. In addition to completing ``normal'' individual assignments, which have many benefits, we wanted to expose students to collaboration early (via, for example, team projects). In this paper, we describe how we leveraged competition and collaboration in a CS2 class to help students learn aspects of computer science better - in this case, good software design and software testing - and summarize student feedback. Games, Educational institutions, Java, Programming, Collaboration, Software testing, computer science education, groupware, program testing, competitive-collaborative approach, software engineering, CS2 class, introductory computer science classes, CS classes, software design, software testing, student feedback",a competitive collaborative approach for introducing software engineering in a cs2 class introductory computer science cs classes are typically competitive in nature the cutthroat nature of these classes comes from students attempting to get as high a grade as possible which may or may not correlate with actual learning further there is very little collaboration allowed in most introductory cs classes most assignments are completed individually since many educators feel that students learn the most especially in introductory classes by working alone in addition to completing normal individual assignments which have many benefits we wanted to expose students to collaboration early via for example team projects in this paper we describe how we leveraged competition and collaboration in a cs2 class to help students learn aspects of computer science better in this case good software design and software testing and summarize student feedback games educational institutions java programming collaboration software testing computer science education groupware program testing competitive collaborative approach software engineering cs2 class introductory computer science classes cs classes software design software testing student feedback,0,0,0,0,0,0,0,0,0,0,0,0,0,0,0,0,0,0,0,0,0,0,0,0,0,0,0,0,0,0,0,0,0,0,0,0,0,0,0,0,0,0,0,0,0,0,0,0,0,0,0,0,0,0,0,0,0,0,0,0,0,0,0,1,0,0,0,0,0,0,0,0,0,0,0,0,0,0,0,0,0.0,0.0,1.0,0.0,0.0,0.0
39,1,8,95,"CodeSmellExplorer: Tangible exploration of code smells and refactorings CodeSmellExplorer is an interactive exploration and learning tool for code smells and associated refactorings, used on a tabletop. The evaluation of our University course about good coding practices shows that undergraduate students frequently fail to recognize bad coding practices without prior training. However, the results also confirmed that gamification elements, such as coding challenges, are regarded as interesting and stimulating. CodeSmellExplorer is an attempt to familiarize users with good coding practices by visualizing an interactive graph network of code smells and connected refactorings. Users can explore those relationships or start challenges with built-in feedback systems. Code smell, refactoring, clean code, tangible interaction, tabletop, visualization",codesmellexplorer tangible exploration of code smells and refactorings codesmellexplorer is an interactive exploration and learning tool for code smells and associated refactorings used on a tabletop the evaluation of our university course about good coding practices shows that undergraduate students frequently fail to recognize bad coding practices without prior training however the results also confirmed that gamification elements such as coding challenges are regarded as interesting and stimulating codesmellexplorer is an attempt to familiarize users with good coding practices by visualizing an interactive graph network of code smells and connected refactorings users can explore those relationships or start challenges with built in feedback systems code smell refactoring clean code tangible interaction tabletop visualization,0,0,0,0,0,0,0,0,0,0,0,0,0,0,0,0,0,0,0,0,0,0,0,0,0,0,0,0,0,0,0,0,0,0,0,0,0,0,0,0,0,0,0,0,0,0,0,0,0,0,0,0,0,0,0,0,0,0,0,0,0,0,0,0,0,0,0,0,0,0,0,0,0,0,0,0,0,0,0,0,0.0,1.0,0.0,0.0,0.0,0.0
